Titulo,Precio
Alcancía Animada No Face Viaje Chihiro Kaonashi Anime,Alcancía Animada No Face Viaje Chihiro Kaonashi Anime
Accesorio * Agenda Death Note * Anime **,Accesorio * Agenda Death Note * Anime **
Alcancia De Gato O Panda Roba Monedas Animada Electronica,Alcancia De Gato O Panda Roba Monedas Animada Electronica
Alcancia De Gato O Panda Roba Monedas Animada Electronica,Alcancia De Gato O Panda Roba Monedas Animada Electronica
Alcancia De Gato O Panda Roba Monedas Animada Electronica,Alcancia De Gato O Panda Roba Monedas Animada Electronica
Death Note Libreta + Pluma + Cd Ost Live Action Serie Anime,Death Note Libreta + Pluma + Cd Ost Live Action Serie Anime
Agenda Death Note Con Cd Y Pluma Anime + Obsequio ,Agenda Death Note Con Cd Y Pluma Anime + Obsequio 
Esfera Del Dragon Llavero Anime Cosplay Goku,Esfera Del Dragon Llavero Anime Cosplay Goku
Cardcaptor Sakura Kinomoto Sakura Figura Precio Unidad Caja,Cardcaptor Sakura Kinomoto Sakura Figura Precio Unidad Caja
Alcancía Animada No Face Viaje Chihiro Kaonashi Anime,Alcancía Animada No Face Viaje Chihiro Kaonashi Anime
Figura Ryuk  + Agenda Death Note Anime Colección,Figura Ryuk  + Agenda Death Note Anime Colección
Alcancía Animada No Face Viaje Chihiro Kaonashi Anime,Alcancía Animada No Face Viaje Chihiro Kaonashi Anime
"Reloj Set Anime De Full Metal Alchemist, Fullmetal Colección","Reloj Set Anime De Full Metal Alchemist, Fullmetal Colección"
Naruto Bandana Hoja  Tachada Coleccion ,Naruto Bandana Hoja  Tachada Coleccion 
Captain Tsubasa Super Campeones Oliver Atom Figura Panini,Captain Tsubasa Super Campeones Oliver Atom Figura Panini
"Set Accesorios Naruto, Anime, Colección","Set Accesorios Naruto, Anime, Colección"
Captain Tsubasa Super Campeones Benji Price Figura Panini,Captain Tsubasa Super Campeones Benji Price Figura Panini
Anillo Itachi - Anime Naruto Anillo Akatsuki  ,Anillo Itachi - Anime Naruto Anillo Akatsuki  
Gorra O Cachuca De Asuka Del Anime Evangelion Orejas De Gato,Gorra O Cachuca De Asuka Del Anime Evangelion Orejas De Gato
Gorra O Cachuca De Ash Ketchum Del Anime Pokemon Cosplay,Gorra O Cachuca De Ash Ketchum Del Anime Pokemon Cosplay
Naruto Coleccion Set X 6 Tam 6 Cm Anime Obs Afiche  Ajd ,Naruto Coleccion Set X 6 Tam 6 Cm Anime Obs Afiche  Ajd 
Captain Tsubasa Super Campeones Oliver & Tom Figura Panini,Captain Tsubasa Super Campeones Oliver & Tom Figura Panini
Naruto Anillo Itachi De Colección Anime Cosplay,Naruto Anillo Itachi De Colección Anime Cosplay
Funko Pop Vinyl - Anime - Hunter X Hunter,Funko Pop Vinyl - Anime - Hunter X Hunter
Kunai Ninja Del Anime Naruto Cosplay Plastico Manga Juguete,Kunai Ninja Del Anime Naruto Cosplay Plastico Manga Juguete
Shenlong Dragón Ball Z Colección Figura Anime 12 Cm,Shenlong Dragón Ball Z Colección Figura Anime 12 Cm
Figura L  Death Note Nendoroid Anime Coleccion,Figura L  Death Note Nendoroid Anime Coleccion
"Figura Luffy One Piece , Anime , Coleccion","Figura Luffy One Piece , Anime , Coleccion"
"Colección X 6 Figuras Sailor Moon Anime, Coleccion Sofitoys","Colección X 6 Figuras Sailor Moon Anime, Coleccion Sofitoys"
Figuras Anime Death Note Set X 6 Kira  Riuk + Regalo Y Envio,Figuras Anime Death Note Set X 6 Kira  Riuk + Regalo Y Envio
Figuras Dragón Ball Boda Goku Y Milk -- Anime - Coleccion ,Figuras Dragón Ball Boda Goku Y Milk -- Anime - Coleccion 
Gorra O Cachuca De Kujo Jotaro Del Anime Jojo S Bizarre,Gorra O Cachuca De Kujo Jotaro Del Anime Jojo S Bizarre
Figura Goku Alas Dragon Ball - Anime 15 Cm Aprox,Figura Goku Alas Dragon Ball - Anime 15 Cm Aprox
Figura Goku Dragon Ball Super The Movie  The 20 Th Film ,Figura Goku Dragon Ball Super The Movie  The 20 Th Film 
Figura Goku Niño En Nube Voladora Envió Gratis ,Figura Goku Niño En Nube Voladora Envió Gratis 
Captain Tsubasa Super Campeones Atajada Benji Figura Panini,Captain Tsubasa Super Campeones Atajada Benji Figura Panini
Figura Goku Bebe  -- Dragon Ball -  Coleccion,Figura Goku Bebe  -- Dragon Ball -  Coleccion
Figura Naruto Shippuden Tercer Hokage Sarutobi Hiruzen,Figura Naruto Shippuden Tercer Hokage Sarutobi Hiruzen
Figura Naruto Kurama Shukaku Colección X 2 Figuras + Envió ,Figura Naruto Kurama Shukaku Colección X 2 Figuras + Envió 
Figura Dragon Ball Z Resolution Of Soldiers Goku Vegeta ,Figura Dragon Ball Z Resolution Of Soldiers Goku Vegeta 
Sakura Card Captor Clow Anime Baraja 55 Cartas Und Ajd 042,Sakura Card Captor Clow Anime Baraja 55 Cartas Und Ajd 042
Izuku Midoriya My Hero Academia Mcfarlane Toys Figura,Izuku Midoriya My Hero Academia Mcfarlane Toys Figura
Funko Pop: Anime - Naruto Shippuden - Kakashi (182),Funko Pop: Anime - Naruto Shippuden - Kakashi (182)
Bandana Naruto Aldea De La Hoja Cosplay Anime,Bandana Naruto Aldea De La Hoja Cosplay Anime
Alcancía De Gato O Panda Roba Monedas Animada Electrónica,Alcancía De Gato O Panda Roba Monedas Animada Electrónica
Dakimakura Eromanga Sensei Sagiri Almohada Anime Sexy,Dakimakura Eromanga Sensei Sagiri Almohada Anime Sexy
Naruto Bandana Anime Cosplay Konoha Manga,Naruto Bandana Anime Cosplay Konoha Manga
Monedero Rana Naruto Anime Sapo Naruto,Monedero Rana Naruto Anime Sapo Naruto
"Figura Shenlong Dragon Ball , Anime Coleccion","Figura Shenlong Dragon Ball , Anime Coleccion"
"Ikaros Sora No Otoshimono Figura Sexy Anime, Envio Gratis","Ikaros Sora No Otoshimono Figura Sexy Anime, Envio Gratis"
