Marcadores,0
0,"Articulo: Marcadores De Arte A Base De Alcohol De Punta Doble, Lineon"
1,Articulo: Juego De Marcadores De Arte A Base De Alcohol 40 Colores
2,"Articulo: Marcadores De Arte De Alcohol De 60 Colores, Marcador De Col"
3,"Articulo: Marcadores De Arte Tombow Dbp10-56168 Dual Brush Pen, Secund"
4,"Articulo: Marcadores De Arte De Alcohol De 160 Colores, Juego De Marca"
5,Articulo: Caliart 40100 Colores Arte Marcadores Rotuladores Individual
6,"Articulo: Marcadores De Arte De Alcohol De 100 Colores, Juego De Marca"
7,Articulo: 80 Set Color Marcadores A Base De Alcohol Arte De Dibujo Gra
8,Articulo: Artify Artist Set De Marcadores De Arte A Base De Alcohol 80
9,Articulo: Caliart 40100 Colores Arte Marcadores Rotuladores Individual
10,Articulo: 48 Marcadores De Arte En Color Set Ohuhu Pincel De Doble Pun
11,Articulo: Hacer Un Punto De Arte! Markers - Marcadores De Pintura Lava
